{"conditions":{"neutral_bottleneck_mutable":{"directionalReproducibility":-0.06388065501939373,"extinctionCount":0,"meanPostShockRuleDisplacement":0.08931599390764566,"medianBottleneckFraction":0.09058089924515918,"medianFinalRuleDiversity":0.0938046255555435,"medianLineageDiversity":0.3150997562500786,"medianPopulationRecovery":0.33741554054054057,"medianPostShockRuleDisplacement":0.0934760386313671,"medianRuleDisplacement":0.14214475128700127,"medianRulePathLength":0.520287945540168,"runCount":12},"scarcity_mutable":{"directionalReproducibility":0.19519329005521635,"extinctionCount":0,"meanPostShockRuleDisplacement":0.09336328063843542,"medianBottleneckFraction":0.09058089924515918,"medianFinalRuleDiversity":0.08715067978699878,"medianLineageDiversity":0.3571573583623078,"medianPopulationRecovery":0.0993465909090909,"medianPostShockRuleDisplacement":0.09192106622237464,"medianRuleDisplacement":0.1620297112168969,"medianRulePathLength":0.5104322509853638,"runCount":12},"stable_mutable":{"directionalReproducibility":0.5040229684127099,"extinctionCount":0,"meanPostShockRuleDisplacement":0.04292675667130991,"medianBottleneckFraction":0.6239329504889026,"medianFinalRuleDiversity":0.10204126969094374,"medianLineageDiversity":0.5492425972903341,"medianPopulationRecovery":0.6447809295998392,"medianPostShockRuleDisplacement":0.04055884268663529,"medianRuleDisplacement":0.13985830292561868,"medianRulePathLength":0.3369379246457943,"runCount":12}},"design":{"burnInSteps":180,"conditions":["stable_mutable","scarcity_mutable","neutral_bottleneck_mutable"],"neutralControl":"stable-resource ecology with mutation retained and a rule-blind random cull at the shock step; cull depth is set per seed from the matched scarcity run's minimum post-shock population fraction","postShockSteps":160,"primaryCriteria":{"neutralBottleneckMatched":"median absolute bottleneck-fraction error <= 0.06","selectiveDirectionExceedsNeutral":">= +0.10 mean pairwise cosine","selectiveExceedsNeutralPostShockMotion":">= +0.015 median paired normalized rule distance","selectiveExcessPositiveInMajority":">= 2/3 of matched seeds","selectivePopulationPersists":"extinction count <= 25% of seeds (minimum tolerance 1)"},"ruleDimensions":["forage_weight","hazard_avoidance","exploration","reproduction_threshold"],"seedCount":12,"seeds":[14003,14011,14029,14041,14057,14071,14087,14101,14119,14137,14153,14173]},"experimentId":"RUL-021","interpretationBoundary":["RUL-021 is an engineered ALife selection-control experiment, not evidence about biological evolution in natural populations.","The neutral control matches bottleneck depth, not the full time-varying demographic trajectory of scarcity.","Both scarcity and neutral-bottleneck arms retain mutation; the primary contrast is resource-dependent selection versus rule-blind demographic loss.","The neutral cull is random with respect to the declared rule vector, but subsequent ecology can still select among survivors.","Post-shock rule displacement is measured from the pre-shock population centroid after a 180-step burn-in."],"observerId":"OBSERVER-ALIFE-SELECTION-CONTROL","pairedComparison":{"medianNeutralBottleneckMatchError":0.0,"medianSelectiveMinusNeutralPostShockDisplacement":-0.009083511843449639,"positiveSeedCount":5,"seedCount":12},"primaryTest":{"criteriaPassed":3,"criteriaTotal":5,"neutralBottleneckMatched":true,"pilotSupported":false,"selectiveDirectionExceedsNeutral":true,"selectiveExceedsNeutralPostShockMotion":false,"selectiveExcessPositiveInMajority":false,"selectivePopulationPersists":true},"ruleSpaceId":"RSPACE-ALIFE-001","schemaVersion":"entropy-rulial-alife-selection-control/1.0.0","simulation":{"initialPopulation":72,"populationCap":150,"runCount":36,"shockStep":180,"steps":340}}
